{
  "$schema": "../schemas/building.schema.json",
  "id": "iron_mine",
  "name": "Iron Mine",
  "category": "production",
  "footprint_cells": 1,
  "construction_cost": { "timber_log": 20, "iron_ingot": 5, "coin": 200, "labor_days": 40 },
  "upkeep_per_season": { "coin": 3, "timber_log": 2 },
  "max_workers": 8,
  "production": {
    "recipe": "mine_iron",
    "workers_required": 4,
    "output_per_worker_day": 0.8
  },
  "tier_min": 1,
  "local_tile_category": "mine",
  "labor_slots": [
    { "slot_id": "miner", "skill_required": "mining", "count": 8, "wage_per_day": 2 }
  ],
  "local_layout": [
    "_________________________",
    "_________________________",
    "____***,***,***,***,*____",
    "___*#################*___",
    "___*#...............#*___",
    "___*#.ppp.......ppp.#*___",
    "___*#...............#*___",
    "___*#.ss.......x....#*___",
    "___*#...............#*___",
    "___*#.ppp.......ppp.#*___",
    "___*#...............#*___",
    "___*#......v........#*___",
    "___*#...............#*___",
    "___*#.ppp.......ppp.#*___",
    "___*#####.+.#########*___",
    "_____*,*,***,*,*,*,*_____",
    "_________________________",
    "_________________________",
    "_________________________",
    "_________________________",
    "_________________________",
    "_________________________",
    "_________________________",
    "_________________________",
    "_________________________"
  ],
  "tags": ["extraction", "mining", "ore"]
}
