{
  "$schema": "../schemas/building.schema.json",
  "id": "market",
  "name": "Market",
  "category": "trade",
  "footprint_cells": 1,
  "construction_cost": { "timber_log": 12, "coin": 20, "labor_days": 20 },
  "upkeep_per_season": { "coin": 3 },
  "max_workers": 2,
  "tier_min": 2,
  "local_tile_category": "market",
  "labor_slots": [
    { "slot_id": "merchant", "skill_required": "trading", "count": 2, "wage_per_day": 3 }
  ],
  "local_layout": [
    "_________________________",
    "_________________________",
    "_________________________",
    "__#####################__",
    "__#p.................p#__",
    "__#.ccc...........ccc.#__",
    "__#.ccc...........ccc.#__",
    "__#.ccc...........ccc.#__",
    "__#p.................p#__",
    "__#...................#__",
    "__#p.................p#__",
    "__#.ccc...........ccc.#__",
    "__#.ccc...........ccc.#__",
    "__#.ccc...........ccc.#__",
    "__#p.................p#__",
    "__#...................#__",
    "__#...................#__",
    "__#########+++#########__",
    "_________________________",
    "_________________________",
    "_________________________",
    "_________________________",
    "_________________________",
    "_________________________",
    "_________________________"
  ],
  "tags": ["trade", "price_discovery", "merchant"]
}
