{
  "$schema": "../schemas/building.schema.json",
  "id": "farmstead",
  "name": "Farmstead",
  "category": "production",
  "footprint_cells": 1,
  "construction_cost": { "timber_log": 15, "coin": 60, "labor_days": 20 },
  "upkeep_per_season": { "coin": 1 },
  "max_workers": 4,
  "production": {
    "recipe": "farm_grain",
    "workers_required": 1,
    "output_per_worker_day": 1
  },
  "tier_min": 0,
  "local_tile_category": "building_interior",
  "labor_slots": [
    { "slot_id": "farm_hand", "skill_required": "farming", "count": 4, "wage_per_day": 1 }
  ],
  "local_layout": [
    "_________________________",
    "_________________________",
    "______#############______",
    "______#.b.......b.#______",
    "______#.b.......b.#______",
    "______#...tt......#______",
    "______#...tt......#______",
    "______#..f........#______",
    "______#...........#______",
    "______#.....^.....#______",
    "______#.....+.....#______",
    "______#############______",
    "______,,,,,,,,,,,,,______",
    "________#########________",
    "________#.......#________",
    "________#.x...x.#________",
    "________#.......#________",
    "________#+......#________",
    "________#########________",
    "_________________________",
    "_________________________",
    "_________________________",
    "_________________________",
    "_________________________",
    "_________________________"
  ],
  "tags": ["agriculture", "food"]
}
