{
  "$schema": "../schemas/building.schema.json",
  "id": "well",
  "name": "Well",
  "description": "A dug or lined shaft providing clean water. Essential infrastructure for any permanent settlement.",
  "category": "infrastructure",
  "footprint_cells": 1,
  "construction_cost": { "stone": 5, "labor_days": 10 },
  "upkeep_per_season": { "coin": 0 },
  "max_workers": 0,
  "tier_min": 0,
  "local_tile_category": "infrastructure",
  "labor_slots": [],
  "local_layout": [
    "_________________________",
    "_________________________",
    "_________________________",
    "_________________________",
    "_____,,,,,,,,,,,_________",
    "_____,,,,,,,,,,,_________",
    "_____,,,##.##,,,_________",
    "_____,,,#~~~#,,,_________",
    "_____,,,#~~~#,,,_________",
    "_____,,,#~~~#,,,_________",
    "_____,,,##.##,,,_________",
    "_____,,,,,,,,,,,_________",
    "_____,,,,,,,,,,,_________",
    "_________________________",
    "_________________________",
    "_________________________",
    "_________________________",
    "_________________________",
    "_________________________",
    "_________________________",
    "_________________________",
    "_________________________",
    "_________________________",
    "_________________________",
    "_________________________"
  ],
  "tags": ["water", "civic", "essential"]
}
