{
  "$schema": "../schemas/building.schema.json",
  "id": "market_stall",
  "name": "Market Stall",
  "description": "A simple covered stall in a market area. Enables direct commodity exchange between the settlement and passing traders.",
  "category": "trade",
  "footprint_cells": 1,
  "construction_cost": { "timber_log": 3, "labor_days": 3 },
  "upkeep_per_season": { "coin": 1 },
  "max_workers": 1,
  "tier_min": 1,
  "local_tile_category": "market",
  "labor_slots": [
    { "slot_id": "stallkeeper", "skill_required": "trading", "count": 1, "wage_per_day": 2 }
  ],
  "local_layout": [
    "_________________________",
    "_________________________",
    "_________________________",
    "_________________________",
    "_____p###########p_______",
    "_____#sssssssssss#_______",
    "_____#sssssssssss#_______",
    "_____#...........#_______",
    "_____+ccccccccccc+_______",
    "_____+ccccccccccc+_______",
    "_____,,,,,,,,,,,,,_______",
    "_________________________",
    "_________________________",
    "_________________________",
    "_________________________",
    "_________________________",
    "_________________________",
    "_________________________",
    "_________________________",
    "_________________________",
    "_________________________",
    "_________________________",
    "_________________________",
    "_________________________",
    "_________________________"
  ],
  "tags": ["trade", "market", "commerce"]
}
