{
  "$schema": "../schemas/building.schema.json",
  "id": "iron_smelter",
  "name": "Iron Smelter",
  "category": "production",
  "footprint_cells": 1,
  "construction_cost": {
    "timber_log": 10,
    "iron_ingot": 2,
    "coin": 150,
    "labor_days": 20
  },
  "upkeep_per_season": {
    "timber_log": 5,
    "coin": 3
  },
  "max_workers": 4,
  "production": {
    "recipe": "smelt_iron",
    "workers_required": 2,
    "output_per_worker_day": 3
  },
  "tier_min": 1,
  "local_tile_category": "forge",
  "labor_slots": [
    { "slot_id": "smelter", "skill_required": "smithing", "count": 4, "wage_per_day": 2 }
  ],
  "local_layout": [
    "_________________________",
    "_________________________",
    "_____###############_____",
    "_____#.............#_____",
    "_____#.ff.......ff.#_____",
    "_____#.ff.......ff.#_____",
    "_____#.............#_____",
    "_____#..A.......A..#_____",
    "_____#.............#_____",
    "_____#.ss.......ss.#_____",
    "_____#.ss.......ss.#_____",
    "_____#.............#_____",
    "_____#.xx.......xx.#_____",
    "_____#.............#_____",
    "_____#######+#######_____",
    "_____,,,,,,,,,,,,,,,_____",
    "_____***,,,,,,,,,***_____",
    "_____***,,,,,,,,,***_____",
    "_____,,,,,,,,,,,,,,,_____",
    "_________________________",
    "_________________________",
    "_________________________",
    "_________________________",
    "_________________________",
    "_________________________"
  ],
  "tags": ["metalwork", "smelting"]
}
