{
  "$schema": "../schemas/building.schema.json",
  "id": "granary",
  "name": "Granary",
  "description": "Raised-floor storage that protects grain from moisture and vermin. Increases effective grain stockpile capacity.",
  "category": "storage",
  "footprint_cells": 1,
  "construction_cost": { "timber_log": 12, "labor_days": 15 },
  "upkeep_per_season": { "coin": 1 },
  "max_workers": 1,
  "tier_min": 1,
  "local_tile_category": "building_interior",
  "labor_slots": [
    { "slot_id": "grain_keeper", "skill_required": "farming", "count": 1, "wage_per_day": 1 }
  ],
  "z_levels": [0, -1],
  "local_layout": [
    "_________________________",
    "_________________________",
    "_____###############_____",
    "_____#sssssssssssss#_____",
    "_____#sssssssssssss#_____",
    "_____#sssssssssssss#_____",
    "_____#sssssssssssss#_____",
    "_____#.............#_____",
    "_____#p...........p#_____",
    "_____#.............#_____",
    "_____#sssssssssssss#_____",
    "_____#sssssssssssss#_____",
    "_____#sssssssssssss#_____",
    "_____#sssssssssssss#_____",
    "_____#......v......#_____",
    "_____#......+......#_____",
    "_____###############_____",
    "_________________________",
    "_________________________",
    "_________________________",
    "_________________________",
    "_________________________",
    "_________________________",
    "_________________________",
    "_________________________"
  ],
  "tags": ["storage", "food", "grain"]
}
