{
  "$schema": "../schemas/building.schema.json",
  "id": "house",
  "name": "House",
  "description": "A modest dwelling for a settler family. Provides housing capacity and a small hearth for warmth.",
  "category": "housing",
  "footprint_cells": 1,
  "construction_cost": {
    "timber_log": 8,
    "labor_days": 10
  },
  "upkeep_per_season": {
    "coin": 1
  },
  "max_workers": 0,
  "housing_capacity": 4,
  "tier_min": 0,
  "local_tile_category": "residence",
  "labor_slots": [],
  "local_layout": [
    "_________________________",
    "_________________________",
    "_________________________",
    "_____#############_______",
    "_____#...........#_______",
    "_____#.bbb.....f.#_______",
    "_____#.bbb.......#_______",
    "_____#...........#_______",
    "_____#...tt......#_______",
    "_____#...tt......#_______",
    "_____#...........#_______",
    "_____#.bbb.......#_______",
    "_____#.bbb.......#_______",
    "_____#...........#_______",
    "_____######+######_______",
    "_____,,,,,,,,,,,,,_______",
    "_____,%%%%%,%%%%%,_______",
    "_____,%%%%%,%%%%%,_______",
    "_____,,,,,,,,,,,,,_______",
    "_________________________",
    "_________________________",
    "_________________________",
    "_________________________",
    "_________________________",
    "_________________________"
  ],
  "tags": ["housing", "residence", "dwelling"]
}
