{
  "$schema": "../schemas/building.schema.json",
  "id": "open_land",
  "name": "Open Land",
  "description": "An unbuilt cell within the settlement territory. Passable, but producing nothing. Can be developed by BuildingPlacer or claimed for construction.",
  "category": "infrastructure",
  "footprint_cells": 1,
  "construction_cost": { "labor_days": 0 },
  "upkeep_per_season": { "coin": 0 },
  "max_workers": 0,
  "tier_min": 0,
  "local_tile_category": "open",
  "labor_slots": [],
  "local_layout": [
    "_________________________",
    "_________________________",
    "_________________________",
    "_________________________",
    "_________________________",
    "_________________________",
    "_________________________",
    "_________________________",
    "_________________________",
    "_________________________",
    "_________________________",
    "_________________________",
    "_________________________",
    "____________,____________",
    "___________,,,___________",
    "____________,____________",
    "_________________________",
    "_________________________",
    "_________________________",
    "_________________________",
    "_________________________",
    "_________________________",
    "_________________________",
    "_________________________",
    "_________________________"
  ],
  "tags": ["placeholder", "passable", "undeveloped"]
}
