{
  "$schema": "../schemas/building.schema.json",
  "id": "grain_mill",
  "name": "Grain Mill",
  "category": "production",
  "footprint_cells": 1,
  "construction_cost": {
    "timber_log": 20,
    "iron_ingot": 4,
    "labor_days": 30
  },
  "upkeep_per_season": {
    "coin": 2
  },
  "max_workers": 3,
  "production": {
    "recipe": "mill_grain",
    "workers_required": 2,
    "output_per_worker_day": 8
  },
  "tier_min": 1,
  "local_tile_category": "mill",
  "labor_slots": [
    { "slot_id": "miller", "skill_required": "farming", "count": 2, "wage_per_day": 2 }
  ],
  "local_layout": [
    "_________________________",
    "_________________________",
    "______###########________",
    "_____#...........#_______",
    "_____#...sssss...#_______",
    "_____#...sssss...#_______",
    "_____#....MMM....#_______",
    "_____#....MMM....#_______",
    "_____#....MMM....#_______",
    "_____#...sssss...#_______",
    "_____#...sssss...#_______",
    "_____#...........#_______",
    "_____#.....^.....#_______",
    "_____#.....+.....#_______",
    "______###########________",
    "______,,,,,,,,,,,________",
    "_____,,~~~~~~~~~,,_______",
    "_____,~~~~~~~~~~~,_______",
    "_____,~~~~~~~~~~~,_______",
    "_____,,~~~~~~~~~,,_______",
    "______,,,,,,,,,,,________",
    "_________________________",
    "_________________________",
    "_________________________",
    "_________________________"
  ],
  "tags": ["food_processing", "grain"]
}
