{
  "$schema": "../schemas/building.schema.json",
  "id": "derelict",
  "name": "Derelict Structure",
  "description": "A collapsed or abandoned building. Uninhabitable without repair — but claimable as free shelter if you don't mind the drafts.",
  "category": "housing",
  "footprint_cells": 1,
  "construction_cost": { "labor_days": 0 },
  "upkeep_per_season": { "coin": 0 },
  "max_workers": 0,
  "tier_min": 0,
  "local_tile_category": "ruin",
  "labor_slots": [],
  "local_layout": [
    "_________________________",
    "_________________________",
    "_________________________",
    "______**###########______",
    "______#*..........#______",
    "______#...*.......#______",
    "_____##..*...*....#______",
    "_______*...*......#______",
    "______#...*.......#______",
    "______#.*..*......**_____",
    "______#*..*...*...##_____",
    "______*##***##*##________",
    "_________________________",
    "_________________________",
    "_________________________",
    "_________________________",
    "_________________________",
    "_________________________",
    "_________________________",
    "_________________________",
    "_________________________",
    "_________________________",
    "_________________________",
    "_________________________",
    "_________________________"
  ],
  "tags": ["shelter", "claimable", "derelict", "ruin"]
}
